UUID,URL,Title,Description,Categories
8f2559b9-6f74-493d-be82-e66c89dc2c2f,http://dkforestseeaaq2dqz2uflmlsybvnq2irzn4ygyvu53oazyorednviid.onion,DarkForest,"Multi purposes website. Chat, forum, links catalog, hacking CTFs and more.","chat,forum"
0e26d07a-8650-4956-a52a-f93a3b50137c,http://juhanurmihxlp77nkq76byazcldy2hlmovfu2epvl5ankdibsot4csyd.onion,Ahmia,Ahmia searches hidden services on the Tor network.,search
9b904948-1f5c-4ae4-b811-69b989d1fd11,http://asapmsp2nsqiyufpnw5bziguahdpxbpyc6jbiss35wgca6ka434w27ad.onion,ASAPmail - Anonymous Email Provider,Tor email host,email
5863d060-1384-46a2-9390-6c545954e0d4,http://ciadotgov4sjwlzihbbgxnqg3xiyrg7so2r2o3lt5wz5ypk4sxyjstad.onion,CIA,CIA is the first line of defense for the United States. We collect and analyze intelligence to further national security and preempt threats.,government
46c21067-8d54-438c-b592-b1259ab52b7d,http://owlzyj4to3l5daq6edgsgp5z4lh4tzlnms4z6jv6xdtkily77j4b3byd.onion,owledge,"Your guide for everything Tor. Privacy is important, and we want to make the know-how accessible quickly to anyone who needs it. ","blog,information,opsec"
94e3e443-e019-4776-9df6-fc913f881840,http://w27irt6ldaydjoacyovepuzlethuoypazhhbot6tljuywy52emetn7qd.onion,InfoCon Hacking and Security Conference Archives,"InfoCon.org is an archive of hacking and security conference videos, documentaries, rainbow tables, wordlists and podcasts.","information,hacking,opsec"
c581ed11-f414-4f11-b596-cb5e09f74a22,http://ctemplarpizuduxk3fkwrieizstx33kg5chlvrh37nz73pv5smsvl6ad.onion,CTemplar,Armored Email,email
6509dc52-33ea-45b7-bf76-90233cd41781,http://bestteermb42clir6ux7xm76d4jjodh3fpahjqgbddbmfrgp4skg2wqd.onion,Best Carding World,Cardable Goods & Money Transfers,forum
ade17d85-4bb2-4590-8c79-b6ccdfb2bcdc,http://blkhatjxlrvc5aevqzz5t6kxldayog6jlx5h7glnu44euzongl4fh5ad.onion,Black Hat Chat,Hacking chatroom using le-chat-php | try !rules or !about or !help,chat
41e3ef1a-5166-4afc-9cb8-0699389a5d86,http://eludemailxhnqzfmxehy3bk5guyhlxbunfyhkcksv4gvx6d3wcf6smad.onion,Elude,"Dedicated to your anonymity; Email, exchange, and mixer available.",email
de476051-4da6-44a3-980f-472a9c111e55,http://dreadytofatroptsdj6io7l3xptbet6onoyno2yv7jicoxknyazubrad.onion,Dread,"Dread is an onion based free speech platform and forum, where you can post, comment and share among tonnes of different communities.",forum
7c4ea4a4-9752-4184-92de-a55ce6079b66,http://fahue6hb7odzns36vfoi2dqfvqvjq4btt7vo52a67jivmyz6a6h3vzqd.onion,Helium,Helium Forum & Marketplace,forum
4c2ca36a-f191-4649-87b7-07baecf976fc,http://kx5thpx2olielkihfyo4jgjqfb7zx7wxr3sd4xzt26ochei4m6f7tayd.onion,Imperial Library of Trantor,The Imperial Library of Trantor (also known as Galactic Library) is a repository of DRM-free ebooks on ePub format.,library
f02d9771-ac97-4b1c-bab6-cdadfd99bd27,http://loginzlib2vrak5zzpcocc3ouizykn6k5qecgj2tzlnab5wcbqhembyd.onion,Z-Library single sign on,Z-Library. Download books for free. Find books,library
55b34b08-de61-490a-88f4-061fa755c2ba,http://libraryfyuybp7oyidyya3ah5xvwgyx6weauoini7zyz555litmmumad.onion,Just Another Library,"Just Another Library: Download eBooks, Images, Videos and Audiobooks",library
9493c0cb-0419-40c1-befe-38998ab570d9,https://protonmailrmez3lotccipshtkleegetolb73fuirgj7r4o4vfu7ozyd.onion,Protonmail,Email provider,email
4c038365-ea07-4c8a-a8d6-285356e99fe1,http://iwr4usy33opfclmbyemzbmnwwnmmqpqltezpac7fyqqkdv3mabtm6kqd.onion,Raklet Search Engine,"Raklet, Accurately fast search engine. Raklet leverages a graph database to provide accurate results based on the influence in the network. Raklet is a member of Black Hat Chat.",search
53fb4932-d8a0-4b42-9349-d9df3945398b,http://cryptbbtg65gibadeeo2awe3j7s6evg7eklserehqr4w4e2bis5tebid.onion,CryptBB,Hacking/cybersecurity forum,forum
9c447b96-1b6c-4d39-abc3-a23ea69afc20,http://darkhgovw3rfguywnntmhvjr45m2cmcrmg55p4k4gale2btcee2c5rqd.onion,Darkhost - Share the things you love!,"Only image files allowed, max 50MiB (52 MB)",imageshare
d26f908f-9495-4315-8aac-2d231c344816,http://archiveiya74codqgiixo33q62qlrqtkgmcitqx5u2oeqnmn5bpcbiyd.onion,Archive.today,Allows you to create a copy of a webpage that will always be up even if the original link is down,archive
f51e51ad-ecdc-4eba-9674-22449c311574,http://hxuzjtocnzvv5g2rtg2bhwkcbupmk7rclb6lly3fo4tvqkk5oyrv3nid.onion,DNMX,Anonymous Email Provider,email
acab60db-be5a-4e85-9106-96f3c4c2a451,http://fhostingineiwjg6cppciac2bemu42nwsupvvisihnczinok362qfrqd.onion,Freedom Hosting Reloaded,Anonymous Freehosting with PHP/MySQL Support,hosting
152b1afd-b6f6-45de-afcd-a6cf72653612,http://kaizushih5iec2mxohpvbt5uaapqdnbluaasa2cmsrrjtwrbx46cnaid.onion,Kaizushi's Little Onion Server,"This is a hosting service with a shared server accessible with SSH/SFTP, and also VPS servers with root access.",hosting
9d9d47c1-fc00-4c4e-ae54-4929d88f0867,http://ic3333h2g3p7ffv6ypscxfvgomi2oj7x45xkqzpay6txjl2nlg5qwcid.onion,ic3,fr0st's diary,blog
62e8c849-91b6-43c8-bdcd-d324ff77be90,http://c7hqkpkpemu6e7emz5b4vyz7idjgdvgaaa3dyimmeojqbgpea3xqjoid.onion,Invidious - Youtube Frontend,Invidious is an open source alternative front-end to YouTube. Invidious is Free (Libre) and Open Source software licensed under the AGPL-3.0. Chat with us: Matrix Libera.chat (IRC) Fediverse: @invidious@social.tchncs.de,"youtube,frontend"
2cdc5488-d73c-4289-8b2b-785aaa5ea431,http://meynethaffeecapsvfphrcnfrx44w2nskgls2juwitibvqctk2plvhqd.onion,MayVaneDay Studios,Vane Vander's personal website,blog
b5ca255b-73d0-4964-8026-ebca5542c77d,http://ylmjp76zk4ndvgpncbtgzrfsrzpblvlzgtuoduqgygwdlexou64iwfqd.onion,MEGA Tor - Chat - MEGA," Chat with thousands of other people from all over the world.  It's 100% free & safe. Just create an account and start chatting right away.",chat
2a4707c2-3527-4fae-a9c3-44cb1cf00ef6,http://u5lyidiw4lpkonoctpqzxgyk6xop7w7w3oho4dzzsi272rwnjhyx7ayd.onion,Hidden Reviews,All reviews of the DeepWeb,utilities
969973f6-6d22-4f1a-aca3-c6d81247eecc,http://hacktowns3sba2xavxecm23aoocvzciaxirh3vekg2ovzdjgjxedfvqd.onion,HackTown,HackTown is a place where you can learn specific skills in hacking and fraud giving you the knowledge and tools needed to become a professional cybercriminal in 2022.,tutorials
4120f38e-911a-40c4-b464-800ed075de7c,http://omensx7ucu4gossi2nwn3l227ka73vsob36yytr3oe32u63ftgi4t4qd.onion,Omen,Omen's Little Home on the Dark Net,"chat,links"
1fe844a2-56a7-48d3-9306-b4db8cea5a3b,http://vww6ybal4bd7szmgncyruucpgfkqahzddi37ktceo3ah7ngmcopnpyyd.onion,Riseup.net - Home,Riseup provides online communication tools for people and groups working on liberatory social change. We are a project to create democratic alternatives and practice self-determination by controlling our own secure means of communications.,"email,information,activism"
fabe8164-4ada-4844-ade9-6873aee12798,http://5gdvpfoh6kb2iqbizb37lzk2ddzrwa47m6rpdueg2m656fovmbhoptqd.onion,Riseup mail,Riseup email login,email
c483912d-19ae-4902-923f-6525bea8c2e5,http://ransomwr3tsydeii4q43vazm7wofla5ujdajquitomtd47cxjtfgwyyd.onion,Ransomware Group Sites," Ransomware Group Sites",ransomware
524a0b54-e344-4422-8620-37e9601ec491,http://inhx4x4y66guy6ljnhq3ijbbgroha5sejcyo2uejmzv6vd3ydwzc6fid.onion,Ransomware wiki,Ransomware Group Sites,ransomware
603260aa-fc6c-4758-9c5a-44d1e1795f65,http://rambleeeqrhty6s5jgefdfdtc6tfgg4jj6svr4jpgk4wjtg3qshwbaad.onion,Ramble,Ramble forum,forum
2eb149b9-b7db-4c1d-b062-4827d9521561,http://sector2nyjrxphgrj3cvnueanomz4trvgyxofvu3cexltoxuegtlmzid.onion,SecTor.City,SecTor.City is a privacy-oriented public mail service that emphasizes total anonymity.,email
b58b2f01-18f4-4996-a052-52cabc5e976e,http://suprbaydvdcaynfo4dgdzgxb4zuso7rftlil5yg5kqjefnw4wq4ulcad.onion,SuprBay,The PirateBay Forum,forum
26a5ec8a-1ee1-44a2-b59c-7786f010cfd9,http://c32zjeghcp5tj3kb72pltz56piei66drc63vkhn5yixiyk4cmerrjtid.onion,Raddle,Raddle forum,forum
df7b3e8d-569f-45a6-96e1-956d58df908f,http://s4k4ceiapwwgcm3mkb6e4diqecpo7kvdnfr5gg7sph7jjppqkvwwqtyd.onion,OnionLinks,Links catalog,links
79297e52-7318-44c6-843f-a6ca6bc71ba9,http://relateoak2hkvdty6ldp7x67hys7pzaeax3hwhidbqkjzva3223jpxqd.onion,RelateList,"New era of Intelligence. Relations, contacts and documents about affiliated organizations.",osint
f1429d07-e3ba-4622-a005-8086f17fefd7,http://cryptonx6nsmspsnpicuihgmbbz3qvro4na35od3eht4vojdo7glm6yd.onion,Crypton.sh,Secure physical phone number in the cloud. For a price of a cinema ticket a month we offer a physical SIM phone number.,sms
fcc10546-c7a6-41af-8b05-5703688af428,http://zqktlwiuavvvqqt4ybvgvi7tyo4hjl5xgfuvpdf6otjiycgwqbym2qad.onion,The Hidden Wiki,Wikipedia like,wiki
c72877a4-c223-43d6-9ff8-513e13753f0c,https://duckduckgogg42xjoc72x3sjasowoarfbgcmvfimaftt6twagswzczad.onion,DuckDuckGo,"DuckDuckGo is an Internet privacy company that empowers you to seamlessly take control of your personal information online, without any tradeoffs. With our roots as the search engine that doesn’t track you, we’ve expanded what we do to protect you no matter where the Internet takes you..",search
63f212f5-422d-4f19-b090-192899b73baa,http://torlinksge6enmcyyuxjpjkoouw4oorgdgeo7ftnq3zodj7g2zxi3kyd.onion,TorLinks,"TorLinks is a moderated replacement for The Hidden Wiki, and serves as a link or url list of Tor hidden services.",links
9fd2fd6b-aae0-4037-953f-6b8cc114dec6,https://facebookwkhpilnemxj7asaniu7vnjjbiltxjqhye3mhbshg7kx5tfyd.onion,Facebook,Connect with friends and the world around you on Facebook.,forum
d15433e7-4b60-42b7-8ceb-10c5bf28408a,http://theendgtso35ir6ngdtyhgtjhhbbprmkzl74gt5nyeu3ocr34sfa67yd.onion,TheEnd,LeChatPHP based chat,chat
8ec10397-b1e9-4503-87b9-5ff77641710c,http://vsociethok6sbprvevl4dlwbqrzyhxcxaqpvcqt5belwvsuxaxsutyad.onion,Vice Society,Ransomware group leaks,ransomware
9bd1065d-eb61-402c-a08c-48a96c13aa39,http://cgjzkysxa4ru5rhrtr6rafckhexbisbtxwg2fg743cjumioysmirhdad.onion,Coarse Enigma | Echo's from the aether,"  Welcome to Coarse Enigma Databank, my corner of cyberspace. Stay a while and read the echos across the aether of the hacker hivemind as filtered through my consciousness.  This in my independant homepage as part of my personal beliefs about computing, consumption and personal growth.","blog,information"
b371d28a-00a4-4f06-b7f8-04864e5af2d1,http://hzwjmjimhr7bdmfv2doll4upibt5ojjmpo3pbp5ctwcg37n3hyk7qzid.onion,Ablative Hosting,Censorship Resistant Hosting,hosting
a0300a43-ef19-43eb-8516-840f8d987142,http://amorph7hyofdtnfkgtu2vfe6obipy3ipij72qsic2rw5gsq37wicmyyd.onion,Amorphous,"Welcome to Amorphous: The chat with a focus on the topics of cyber security and programming. Here we discuss many topics such as programming, hacking, malware, botnets, reverse engineering and much more! If these topics interest you then come join us in the chat to get started. Tesseract and lew are the only admins.",chat
a6a8ae9f-eac2-434b-a775-e2be8b920a9d,http://it7otdanqu7ktntxzm427cba6i53w6wlanlh23v5i3siqmos47pzhvyd.onion,DarkTea,Host your own git repositories on the Tor deep web.,"git,repository"
fa3d62ee-11d8-4d21-b37d-2bb9a75cb9f5,http://darkodemard3wjoe63ld6zebog73ncy77zb2iwjtdjam4xwvpjmjitid.onion,Dark0de,Market - No longer in operation due to exit scam,market
ec98b674-5f27-4d52-9875-e83488d90684,http://deeeepv4bfndyatwkdzeciebqcwwlvgqa6mofdtsvwpon4elfut7lfqd.onion,DeepLink Onion Directory,Onion directory,links
6e062ed6-ae54-4c5b-a9b6-a1c3d303ca4c,http://7fc532c5lvbky6lxlt3gxnbj67gqmpzym2rowtekllgypyprbjxfiiad.onion,My Onion Bookmarks,My Onion Bookmarks,utilities
a4c6b303-63c7-4c9a-aa68-851e742e5731,http://nv3x2jozywh63fkohn5mwp2d73vasusjixn3im3ueof52fmbjsigw6ad.onion,Comic Book Library,A library of downloadable comics.,library
ecea7e42-d796-4b2d-99ff-c445b720cebd,http://tssa3yo5xfkcn4razcnmdhw5uxshx6zwzngwizpyf7phvea3gccrqbad.onion,The Secret Story Archive,"An archive of zoophile, furry and anthropomorphic stories.",library
da55a314-33b7-4b9b-9fbb-4ea0e493ac86,http://libraryqxxiqakubqv3dc2bend2koqsndbwox2johfywcatxie26bsad.onion,The Anarchist Library,The Anarchist Library,library
205aca38-88e9-4761-bc67-d85166fc2596,http://66r36rdl6u5avuslogbek3dbircesmvc6m236nvwpzyks7g7nitkanad.onion,Anarchist Bookstore," WHEN INJUSTICE BECOMES LAW, RESISTANCE BECOMES DUTY.",library
b9b966ef-3ddf-46db-8b8f-959c772f15de,http://educate6mw6luxyre24uq3ebyfmwguhpurx7ann635llidinfvzmi3yd.onion,educate.onion,Open Data Directory Archive,library
4acf6ea2-6dd3-4567-a0a9-43d062e9fcd6,http://anarcopym4ckplfg3uljfj37y27ko3vrnrp43msyu5k5rp3h46wtf7yd.onion,Anarcho-Copy,Turkish-language library,"information,library"
9a337909-93c2-41b5-9efa-1b83f7f46519,http://flibustaongezhld6dibs2dps6vm4nvqg2kp7vgowbu76tzopgnhazqd.onion,Флибуста | Книжное братство,,library
701ba786-fe36-4f70-a785-961867009173,http://booksihtmsp36axxmnkkfjvpwenvxu4mhdwg5mmdvmeip3a6c4tnnsyd.onion,Большая онлайн библиотека e-Reading,"Более 100 тысяч книг. Релевантный поиск, простая и удобная навигация. Система автоматической рекомендации книг. Обзоры книг. Ежедневное пополнение новыми книгами.",library
0c1a4b27-f7da-4d55-9a9d-0583d83365a3,http://4drjmo7z2dld4mci2limogypdibxxpg7dad6g2snnrdufw6lcradc2qd.onion,Paradise,"Are you enraged by the unresolved injustice in society, yearn to educate others about suffering that hardly anyone is aware of, or are even just passionate about learning different problems around the world? Then you may flourish in Paradise, a chatroom born to give the opportunity to learn, share, and perhaps even help solve the social issues that dominates our planet. Created for everyone, you can freely exchange thoughts and ideas on these obstacles without worrying about prejudice or disrespect. If you'd like to contribute to the community, then just grab an account and start chatting!",chat
0df2b275-8494-4bec-b9fe-f4235cd2d437,http://metagerv65pwclop2rsfzg4jwowpavpwd6grhhlvdgsswvo6ii4akgyd.onion,MetaGer,Sicher suchen und finden unter Wahrung der Privatsphäre. Das digitale Wissen der Welt muss ohne Bevormundung durch Staaten oder Konzerne frei zugänglich sein und bleiben.,"deutsch,search"
281f5bd5-fb38-43b5-8f30-6ccc65ecfd66,http://jp66h4x3kjilg2yb5m4tumv2ddfnhykhwdw7vwm6a5s5h2ghhuelyqad.onion,Cadaver's site,Personal website | blog,blog
0d0e005b-2f0e-46b0-9bad-d9083dee7b0a,http://fyng2tsmzmvxmojzbbwmfnsn2lrcyftf4cw6rk5j2v2huliazud3fjid.onion,SimplyTranslate Instance,Experience simple and private Google translations,"translate,frontend"
5a08c8d9-c8dd-492f-8b7b-b1a3185c862a,http://rvm73cldah6tkn3bxek2x5ya47zh4iaisci42yvmlq5e6rdjafuhsbad.onion,Kilos,Dark Net Story,blog
ec94c7b7-16c3-4056-88e6-c012306dbb1d,http://trebzwp2nyrsq6urxkeif7iz5vpf3ppnlzvy6xdxwomgebx2vpczzsqd.onion,Pasta,Share text/file,"pastebin,software"
7e62a983-08c6-45d1-a41b-bb79e83e822d,http://pdcdvggsz5vhzbtxqn2rh27qovzga4pnrygya4ossewu64dqh2tvhsyd.onion,Antinalysis,Blockchain privacy-Secure your on-chain anonymity,"utilities,coin_exchange"
2c37c66e-e119-4f92-86e2-aa31e1a86202,http://darkfailenbsdla5mal2mxn2uz66od5vtzd5qozslagrfzachha3f3id.onion,dark.fail,Which darknet sites are online?,links
bee73f68-b221-4308-ae35-da767b22646f,https://dwnewsgngmhlplxy6o2twtfgjnrnjxbegbwqx6wnotdhkzt562tszfid.onion,DW News,News and current affairs from Germany and around the world,news
72cf06e6-c9d2-4021-8750-ce6e4f7c800a,http://p53lf57qovyuvwsc6xnrppyply3vtqm7l6pcobkmyqsiofyeznfu5uqd.onion,ProPublica,"ProPublica is an independent, non-profit newsroom that produces investigative journalism in the public interest.",news
28276803-fc47-4e47-9446-70530c651982,http://fpfjxcrmw437h6z2xl3w4czl55kvkmxpapg37bbopsafdu7q454byxid.onion,Freedom of the Press Foundation,Freedom of the Press Foundation protects and defends adversarial journalism in the 21st century.,news
22fc1298-ce46-49f2-a04c-07c580ef07cf,http://3nzoldnxplag42gqjs23xvghtzf6t6yzssrtytnntc6ppc7xxuoneoad.onion,Invidious Instance | Youtube Frontend,,"youtube,frontend"
4b22edfa-9010-4ebe-bf85-6d813e00cacd,http://zsxjtsgzborzdllyp64c6pwnjz5eic76bsksbxzqefzogwcydnkjy3yd.onion,Shadow Wiki,"Welcome to the ""Shadow Wiki""!  This wiki focuses on (where applicable):      Nanonymity (Privacy + Security + Anonymity), Spyware, Surveillance, Censorship, Interoperability and Decentralization.  Hardware, Software, Politics, Religion, Not just what is mainstream, but also that which is obscure or esoteric. Where things are made, how renewable they are, and their quality. This is the orange pill.","wiki,opsec"
3d90024a-5910-4dc7-a3ee-0f56be4180e3,http://us3xsdrhmhk4h3bkuq7ttkp6pocs4726esycpgwtogrpu3nfjj6eroqd.onion,Shadow Forums," AsmBB v2.8 (check-in: e9a1aa146ae9b319); SQLite v3.31.1 (check-in: 3bfa9cc97da10598);",forum
958b4ec5-51d8-46c6-adc2-c7c58b3042d6,http://cct5wy6mzgmft24xzw6zeaf55aaqmo6324gjlsghdhbiw5gdaaf4pkad.onion,Snopyta,"Snopyta runs online services based on freedom, privacy and decentralization.",frontend
5a88d68c-b80c-4458-8afa-7116a64c146a,https://27m3p2uv7igmj6kvd4ql3cct5h3sdwrsajovkkndeufumzyfhlfev4qd.onion,The Intercept,"Fearless, adversarial journalism that holds the powerful accountable.",news
ef2ce46a-efb2-4afc-b95f-67668518dad5,http://correct2qlofpg4tjz5m7zh73lxtl7xrt2eqj27m6vzoyoqyw4d4pgyd.onion,Correct Horse Battery Staple,xkcd-Style Password Generator,generator
2137b3f3-0bce-47f4-9890-0c3fc38ea279,http://lkiw4tmbudbr43hbyhm636sarn73vuow77czzohdbqdpjuq3vdzvenyd.onion,HardenedBSD," Founded in 2014 by Oliver Pinter and Shawn Webb, HardenedBSD is a security-enhanced fork of FreeBSD.",software
874e672b-3608-4b67-aaa9-63f7c3bea0c9,http://ii72bjpditizloapohdkpbepu6pkf7rz2jxgsuwebfcn5q5x6qa3xwqd.onion,Debian Backports,"You are running Debian stable, because you prefer the Debian stable tree. It runs great, there is just one problem: the software is a little bit outdated compared to other distributions. This is where backports come in.  Backports are packages taken from the next Debian release (called ""testing""), adjusted and recompiled for usage on Debian stable. Because the package is also present in the next Debian release, you can easily upgrade your stable+backports system once the next Debian release comes out. (In a few cases, usually for security updates, backports are also created from the Debian unstable distribution.)",debian
44575bbc-c985-4d57-a1b7-9b5cd09bc282,http://psyciumunsqarzsehz5xlgsi2mg4dkvntwf5bwj5kwbcbazwiuhna2ad.onion,#youbroketheinternet (YBTI),A radical proposal to keep your personal data safe,"software,activism"
eeb08742-7382-49c6-8f1b-09fb872bd1a6,http://yrdsfikfhnlop22gqmo4szwdwowiqbs3soq5xzbvjiz2r2uplxkshaqd.onion,CyberChef,"The Cyber Swiss Army Knife - a web app for encryption, encoding, compression and data analysis. CyberChef - The Cyber Swiss Army Knife.","utilities,software"
734d100f-2deb-44c6-b9e1-950c42868abf,http://xanthexikes7btjqlkakrxjf546rze2n4ftnqzth6qk52jdgrf6jwpqd.onion,Let's Decentralize - Alternatives to the standard internet stack,"This is a website dedicated to methods of decentralized publishing on the web. The name is a reference to Let's Encrypt: what they did for securing network transmissions by offering free TLS certificates, making HTTPS possible for small indie servers, this website hopes to do for web hosting by offering simple instructions on how to host a website at home as opposed to spending exorbiant amounts of money on hosting on someone else's server. Other than the (optional) purchase of a Raspberry Pi or other small server if one wants to go the client-server route (or have a seedbox for their peer-to-peer sites), none of these options require any money to be spent, meaning there will never be any ""web3"" nonsense on this page and there never will.","information,links,software"
ae20a030-58b4-4661-b96d-1d60474d61b0,http://62e66ms4zady3ljajy2ojppkshephaerx7rtzp4nuco7a6s33abbfmad.onion,Mambo,,
f6e9a021-6144-4318-b275-7203ac3045ad,http://ubnm4kfxmjglxh2zrlunbxubg3knzr6wumixzkl5xmkc7h5oho4lx4qd.onion,Hidden Corner,"Here you will find: Computer stuff, rants, journals (usually about updates to this website) and more. Visit the PDF library for some cool books.","library,links,blog"
028cb133-0a55-407f-bd88-8da2a808bf18,http://deepweb4wt3m4dhutpxpe7d7wxdftfdf4hhag4sizgon6th5lcefloid.onion,DeepWeb / Dark web links,"A darknet news site also offering an XMPP server, a disposable email service, one-time notes, and an onion sites search engine.","email,news,xmpp,tempmail"
44230e3b-19af-4f85-9ba8-557b307f07e2,http://q3o3hdjbf6vwxdnpskyhxw7w7rnmnfhz2szbuala4q24x6csbp7adiad.onion,Home | Hidden Services Today,Place with best and fresh links to services hidden in the Tor network! We try to keep this place free of spam and scam. Only trusted and safe links to various services. No child pornography and other sick content. We are here for you since 01.01.2020!,links
44ed49a0-fb3d-4c06-ae05-abdbfe18d93c,http://diasporg5tj4xz5mxkd5qnrppo7tbb6ynk2gtmjw5lmz6mtbesj3k6id.onion,Diaspora," Part of the diaspora* federated network The online social world where you are in control",forum
8424fe88-f15b-4323-8e7f-39041e6caf4b,http://incoghostm2dytlqdiaj3lmtn7x2l5gb76jhabb6ywbqhjfzcoqq6aad.onion,Home | IncogNET,"Privacy Focused Hosting; Private and free speech webhosting solutions in the United States, Netherlands, and Finland.",hosting
d27f81d3-39e0-4e33-8fb2-a0a14ba37886,http://lp5c4ebkb34ogij3vqxuars6iqnfvierojhmnzcodnzpwc4pjo6wb4ad.onion,Latest Privacy,"We know how hard it is to keep track of privacy, we want to change that by making it easier to follow.","news,activism"
f826da68-d750-44d9-be6c-6491cd87e5e1,http://tirxscsg3pcenlff67ecn2kb3jfv3ori7bgwryyn7btktohfdkms2cyd.onion,NO TO CHINA,an onion website dedicated to listing articles and videos of China's abuse towards other countries,activism
997b3090-8ec0-443d-a39f-2f9a008d7ad6,http://dpzi7eub6xk73ps3xf2hus75scgrwbxj76qfudqxdji67dgwvhakosad.onion,"Blender.io | Bitcoin mixing service, Secure and Anonymous Bitcoin Mixer",Protecting your anonymity since 2017. Service address: 14ht1KvGaXD8QgYobJYDT4gTSxNoUBYdFs,cryptocurrency
a7fb7b31-917b-4429-bc4c-b6e4ccaab5a0,http://p2blcmrur23gmaw4lm36rtka6njclzlaymcmnh4c7ytliuon35eouhyd.onion,SecretsBox,"DATABASES, LEAKS, DEANONIMIZATION, PERSONAL FILES",leaks
025a60ea-f366-4168-8ab1-561b1d1cebd6,http://geocitiesllczuf44da2nj45jn3fntdjpw27ercfbhkrw3mnegti7pid.onion,GeoCities - The Largest Community on the Web! ,"You are about to adventure to the internet of old. Be warned. These pages are user generated. If you find any illegal material please report it. Browse, search or jump to begin your journey.",archive
7250f4bc-ef7d-4fcf-8800-dcb50019c2f4,http://3gwn24bmkgepupahneplrh24iu7oiodl3gvxf2p6x3l2athij6vjsrad.onion,Recipebook.bentasker.co.uk,It's basically just a place for me to paste recipes so I've got them all in once place. (Edible programs in Chef Language),"tutorials,software"
ff1932a5-6a71-4146-b18b-1e6c31c4838c,http://opseccsthnq6nqd6crm2gt2pqszspyr5w44pffhf2grxtiqq67sii4ad.onion,Cybertoolbank.cc,"Cybertoolbank is a 2 year old archive of privacy, opsec, security, and osint tools, plus much more. One of our main goals is to teach everyone opsec and online privacy. For more info, join our telegram, link below. If you like this project, feel ""free"" to donate. It's not free to operate this website and we want to keep it fully ad-free.",utilities
a3533636-c61d-4f10-ba72-6f468cb9a14b,http://pzhdfe7jraknpj2qgu5cz2u3i4deuyfwmonvzu5i3nyw4t4bmg7o5pad.onion,Tor Project Blog,Tor Blog by The Tor Project,"blog,news"
454535a5-8e75-42a9-8dd8-ec7262b0bbf3,http://lgmtjgfpqk6hpik7yygkhavqivn6wsmfa7s7vszmcxwqkpwodinbhnad.onion,No Tone,CLICK FOR TUNES (artist page),"blog,music"
7690371a-25ff-4b25-86b3-324d9114528a,http://darkbin5z7y4465svqxezlmynafqd2zztkyiiwi3xfnv5fdc7jqo4bad.onion,DarkBin,Tor pastebin,pastebin
49eaa2a2-9add-4521-914e-340b89c535ab,http://occgshn6gz4je57wyhpijni7waod6yxpxwihjdxjwrnpjtbayliei2id.onion,Cyberia,Welcome to Cyberia. We provide various open and free Internet services since 2016. The word Cyberia is a reference to the nightclub Cyberia Café & Club from Serial Experiments Lain.,"links,irc,utilities"
e40bdf60-608f-41a1-a5cd-76a0d4f29853,http://fev4bgoasgxttqb3x3tukxxia6lwryteq6a2ramqb2gjiol3zbu6xaid.onion,Rocksolid Light - rocksolid,Reality is just a crutch for people who can't handle science fiction. ,forum
ee8edb79-c61d-4201-89e8-bb08334471ea,http://shredd4sj5swuz7aib36wqkqtcd2bhndqrwglnepjqazgwh2vfhlbvad.onion,Shredd,because is a human right; by DotOnionsTeam,"utilities,fileshare"
c3857eb2-e66e-4187-94ad-d959e6aabbb6,http://malcolmmr2dxaud2q4ejmrhxzfw3bnb7rxt6mfnx6ytahadmszktk5yd.onion,Malcolm,,
2d29064d-dc63-4b95-84bb-7e39e58482f3,https://brave4u7jddbv7cyviptqjc7jusxh72uik7zt6adtckl5f4nwy2v72qd.onion,"Brave Browser | Secure, Fast, & Private Web Browser with Adblocker",Browse privately. Search privately. And ditch Big Tech.,software
aa3acfae-c641-400f-958c-f8a77db9bb5d,http://tmnguwi25tpvx6lhsmmnxwqvkntepyqtaz3adhcezudl74ae7oclc7id.onion,Radio Deep Web,"Listen to the Best Songs, Without Going Surface!",music
830c4d8f-2da4-4173-b675-c2baf90fa2cd,http://kfahv6wfkbezjyg4r6mlhpmieydbebr5vkok5r34ya464gqz6c44bnyd.onion,EtherPad Instance | Riseup,"This is an etherpad service hosted by Riseup.  This service is supported by donations of users like you, please donate!  Etherpad is a software libre web application that allows for real-time group collaboration of text documents. Riseup does not store IP addresses, we require https, and pads are automatically destroyed after 60 days of inactivity.","etherpad,frontend"
4155a364-d463-4c4a-8d3c-3313adf10cea,http://pgpfail4gnkxlxf6ij76quyafrlwwzouoht5tsp7wa3qt37enbnjluad.onion,pgp.fail,"PGP.fail: verify, don't fail. A collection of pgp keys. ctrl + f to search","keyserver,utilities"
22816032-6a71-4ed9-9296-171bbf27bf16,http://bvten5svsltfpxrxl72ukqxixwo2m5ek5svmcxgrmkta4tbmiemuibid.onion,BeneathVT,Exploring Virginia Tech's steam tunnels and beyond,blog
