UUID,URL,Title,Description,Categories
c29cb794-bfea-42a0-9707-c51f4b20a729,http://knhksaja4gyorhkp7e4s277goqssx3ghcxfe2sfubrspssljqzhpemqd.onion,mckanony411's Blog,I'M A S.W.I.F.T PROGRAMMER / SENDER. YOU CAN EMAIL FOR ANY TYPE OF S.W.I.F.T TRANSFER >MT103 CASH TRANSFER >MT103 TELEGRAM TRANSFER (TT) >MT103 SINGLE CUSTOMER CREDIT TRANSFER >MT103 GLOBAL PAYMENT INVESTIGATION (GPI) WITH UETR CODE >MT199 PROOF OF FUND >MT799 PRE-ADVICE >MT760 STANDBY LETTER OF CREDIT (SBLC) >MT700 LETTER OF CREDIT (LC)< >ALL ARE AVAILABLE IN SEMI-AUTOMATIC AND FULL AUTOMATIC. >NOTE: YOU MUST KNOW THE TYPE OF INSTRUMENT YOUR BANK ACCEPT BEFORE. ALL AT AFFORDABLE PRICE. NO ROOM FOR NEGOTIATION BUT I WILL NOT GIVE YOU A SPACE TO DOUBT WHAT AM CAPABLE OF.  Email: Mckanony15411@dnmx.org,blog
bbd75814-5603-4f2f-bbd6-b6a4a927ced7,http://ynsu5r5jcfldeile3wy7zvmszefxob4oef6xgvib56e5osxpcfowduqd.onion,Piping Server,Streaming Data Transfer Server over HTTP/HTTPS,fileshare
10fc0ba4-4335-4f0a-97a3-d434da6d8571,https://nickf43ab43xxf3yqgzy5uedsjij6h473rmbyzq6inohcnr3lohlu3yd.onion,Nick Frichette - Software Developer and Security Researcher,"My name is Nick Frichette and I'm a Senior Security Researcher, primarily focussed on cloud, web application, and CI/CD exploitation. Previously, I worked as a Penetration Tester and Team Lead for a large financial services company.  In my free time I perform security research, participate in CTFs, and engage in community forums. In addition, I'm the primary maintainer of Hacking the Cloud, an encyclopedia of the techniques that offensive security professionals can use against cloud environments.  Aside from that, I'm fortunate to be a part of the AWS Community Builders Program and I also support the Tor project through my Tor nodes.","blog,personal"
092491a5-cb43-4006-b919-604f03499f9a,http://eter4u55b667kuo72ntpm7ut54sa2mxmr22iqgzns4jw7boeox3qgyid.onion,Privacy Guides,"Privacy Guides is a socially motivated website that provides information for protecting your data security and privacy. We are a non-profit collective operated entirely by volunteer team members and contributors.  Our current list of team members can be found here on GitHub. Additionally, many people have made contributions to the project. You can too, we're open sourced on GitHub!","information,opsec"
14c92ab7-09d7-4cb6-be4c-4433fa14c1f9,http://y4rwggmc7ra3eu45cs6hfw2qg7o6c6a5ntn3rslfy54plgwzu2mwe7ad.onion,"Procarding | Carding tutorials, Tools. Carding Methods, and Basics","latest Carding tutorials ,and many more for carding business.  Latest carding methods and tips","fraud,information"
8d7fe70a-a2a8-40c2-af0d-ac04fe96600d,http://lbv4qhye66mxvqobp25pmda4n4sphslsva4qzfrmxyctzl6j3s7w6kqd.onion,Library of DUCKTOR,Ducktor Library - The Darknet Duck.,library
a9254a5f-d132-4165-a067-0f4de58b0915,http://rovzblvirtryseu7tezwv76mvlgid67mhadrmb2lgw73l6sngim4gpqd.onion,Huntington Bank - Bank Logs,Leaked bank logs and data for sale.,"market,fraud,leaks"
53030641-7c5f-4827-ac3c-e143393de7bd,http://lpar7l72ykloj2rnfpq335ydvaecujl5erpzi6exf2w2h4otrdsywdyd.onion,Formulaire d'inscription,Please contact Administrator ( e6n9d0h4i4t1p3l9j5o6@gtfcy37qyzor7kb6blz2buwuu5u7qjkycasjdf3yaslibkbyhsxub4yd.onion ) for further assistance. Proudly powered by LimeSurvey - The Online Survey Tool - Free & Open Source ,misc
0d20a527-4125-4d71-8010-663054c32ca0,http://rsyu5frcrlyrepvvrsolzn6sgvkjoiykqlg7dtl52xtqiyhqtartumad.onion,DUCKTOR - Half Duck Half Tor,"Ducktor Home Page. Chat, Radio, and Library linked.",misc
e9465ee8-851e-4881-811b-c9be743dce8c,http://u2frppcgwqmoca7h3hu5l72upkwhcf2n6umrkqsnvnpahjynkre6sqyd.onion,DUCKTOR RADIO,Listen Live,"chat,irc,music"
75c75a8c-e834-4b46-bde0-f7565a37789f,http://matrixkalfksqa4nhf3u6542tyrpsjhxaar3zpdwgrr4vggrlchpvwqd.onion,Matrix,Reddit-like Tor forum,forum
6b2b5871-cbf0-4940-8b23-f3cdf5ef52c1,http://sirh5ymakqk42c4pyghdtgti7nzhx3xlncrtvoj2ttaybj3vv7tppzqd.onion,CryptoTools.net - Home,"Welcome to CryptoTools.net! This site contains a suite of cryptographic utilities for convenience that operate entirely on the client side. No calculations take place on the server, nor is any data generated or used here sent to the server.  If you like, you can view our source on GitHub.",information
bfae3f6b-4fc1-4dd1-9756-efa96d48dbc5,http://torfish7kblk4gvostgkzdddp4ngp4cxxsl2oqfdbyzrlsz3x3j7fbyd.onion,Tor.Fish - Your trusted darkweb portal,our trusted dark web portal - Keeping you safe from scam and phishing (but not fishing) sites,links
6d746b1c-891a-431f-9d79-d11401d592c5,http://ti4mfvefw2sx2xpf2l3dpaa6iuwiors7ef3hm3nyal7xhq3chrygorqd.onion,Qubes OS Software Repository Mirror,"distfiles, ISO images, qubes-windows-tools, repo","qubes,repository"
daa85e68-458e-4e7e-8154-4940d765694e,http://2ptpv4mi2xtkcn5vrbga4wpgcm2neksgkawn7bwdfmysek6mqytjcwqd.onion," Distro Summit @ LCA 2010 - 18-23 January 2010 - Wellington (New Zealand) ","The Distro Summit 2010 takes place on Monday, 18 January 2010 in the Civic Suite 3 in the Wellington Town Hall.  The Distro Summit 2010 is a one-day developer conference with a strong focus on collaboration between free software distributions hosted at the linux.conf.au 2010. In addition to a schedule of technical, social and policy talks, the Distro Summit provides an opportunity for developers, contributors and other interested people to meet in person and work together more closely.  Previous similar events have featured speakers from around the world. They have also been extremely beneficial for developing key free software software components and for improving collaboration and sharing between the different distributions.",software
0414c102-b7d9-4bc0-8e78-41b4db701a95,http://wsfpfmgiosnkaggxo4dy4uyxrbtnaybvjro6gfyhpa4mg5xolfiao2ad.onion,Anonymous Temp Email,Disposable Email Provider,tempmail
08150f19-029a-4d89-ac46-9ede7696a133,http://7usmmmrwhpwbut6ugdixwarplq5p4m6dtqrubwxipb44c5jjl3437fqd.onion,Spagetts' favorite FOSS Games,"Games listed are Multiplayer or single player, and have been tested on a 10 year old desktop with 4 GB of RAM running Debian OS. All games listed are open source without ads or spyware.",games
b2812176-acf5-496f-a933-0d102078847c,http://b5t7emfr2rn3ixr4lvizpi3stnni4j4p6goxho7lldf4qg4hz5hvpqid.onion,Index of / - Official mirror of https://aus2.torproject.org/ ,,"repository,tor"
99d66253-c4bd-4888-9d69-7abb4a812771,http://txkpcshjd7o2hhtgqbelox6jk27nlvsjlmbqpuvnviinrb7k5i2ai2ad.onion,DarkRise : The Darknet doesn't fail,his site only provides official links. Game over to phishing. Check: What markets REALLY exist on the darknet? Check the full tour of current LEGIT marketplaces.,"links,market"
6c62db1a-aedc-4fa7-8ede-ae3226f04881,http://monerod2jqtblreunnwtzqbjjj4slvsd3cjbhnzt2evwnry5u772l3qd.onion,Monerod XMR Mining Pool | Home,"A Nonprofit & Entirely Open Source Monero Mining Pool XMR is decentralized, anonymous, financial freedom. ",monero
1d9198e2-0a5e-44df-bd6a-90ebe296ba4f,http://7dw7foypguycptlodmkscnziw5a65ilivzz6ajiei3yhe3gsfojlqwad.onion,Nex | SecureDrop,"  Powered by SecureDrop 2.4.0.  Please note: Sharing sensitive documents may put you at risk, even when using Tor and SecureDrop.  SecureDrop is a project of Freedom of the Press Foundation.","securedrop,whistleblowing,fileshare"
626a1ec0-15ea-4292-931a-8aaf9a72f2c0,https://hongio267dx4o2ofkn4ddsztu4ok2vq4euc7sxumbi7kcfd64ije62ad.onion,Shen's Essays (Philosophy and Computer Science),Shen's Essays © 2022 Powered by Philosophy,blog
25a64354-283f-46f3-a154-6d22b38c8bbb,http://qmifwf762qftydprw2adbg7hs2mkunac5xrz3cb5busaflji3rja5lid.onion,CNN | SecureDrop,"  Powered by SecureDrop 2.4.0.  Please note: Sharing sensitive documents may put you at risk, even when using Tor and SecureDrop.  SecureDrop is a project of Freedom of the Press Foundation.","securedrop,whistleblowing,fileshare"
9fbe22ef-fcd5-4ea3-b1ef-b892dbf1488e,http://mlucvtipzluwceniyzwxt52a3wdvu3t3ahdshht3sctc6hs4o2umqjad.onion,Liberty Witch,"My purpose here is to contribute to the usurping of the homogeneous corporate internet. You can find others involved in this effort here too. Make your own website and share it with others for your chance to WIN.  This website is still being worked on but I hope you find something of interest in the meantime. Please don't hesitate in contacting me with any of your queries, suggestions, or comments. Thank you!",blog
1b5ff35f-3886-4a79-8477-3d247bc8d313,http://ey3nd234koo5egxfexe3sdcfj5cdmnyss7fjxv73ek3x34txp2mg2dyd.onion,AI CRYPTO BLOCK,Il n’est pas exagéré de considérer que le Bitcoin est révolutionnaire. Nous sommes dans une période unique et privilégiée où l’on peut faire quelque chose d’ambitieux et de disruptif: révolutionner l’argent.,cryptocurrency
5d06657c-ea2f-4d64-a5bf-5a3faff3db6b,http://testaus6utu7l6kklha7jqmj57fukzhroi2sj5md23kxjsbbrimt2fyd.onion,Testausserveri," Testausserveri on Testausserveri ry:n ylläpitämä kaikille avoin yhteisö koodaamisesta, eettisestä hakkeroinnista ja yleisesti teknologiasta innostuneille nuorille (ja nuortenmielisille). Kehitämme yhdessä erilaisia mielenkiintoisia projekteja, joita voit tsekata alta.  Keskusteluihimme on helppo liittyä matalalla kynnyksellä, sekä kannustamme jäseniämme kehittymään kanssamme. Tutustu arvojäseniimme! ",forum
e406e1b1-859d-4072-9a43-e0cd0d122c6b,http://fhrkds5du4uvv33ibce5bnwppih6kkzyam7othip4dywrpy46rxoytid.onion,The Markup | SecureDrop,"  Powered by SecureDrop 2.4.0.  Please note: Sharing sensitive documents may put you at risk, even when using Tor and SecureDrop.  SecureDrop is a project of Freedom of the Press Foundation.","securedrop,whistleblowing,fileshare"
0b0e0ec9-01c1-4d02-8784-d867e2ac8979,http://p2pmin25k4ei5bp3l6bpyoap6ogevrc35c3hcfue7zfetjpbhhshxdqd.onion,MINI.P2Pool.Observer,Decentralized pool for Monero mining ,monero
7055518a-b3c1-40b4-9da7-efd0f5825fb8,http://p2pool2giz2r5cpqicajwoazjcxkfujxswtk3jolfk2ubilhrkqam2id.onion,P2Pool.Observer,Decentralized pool for Monero mining ,monero
227ef3e0-3fd6-46ce-a48c-ac9bb66583b1,http://aehssc7l2j7ybzytgus3svsdgqjcjw2u63znyc7at7yw2mgeryvgb6yd.onion,Unobtanium Dice,Small Stakes Dice on the UNO Blockchain. Max bet = .01 Uno. Minimum bet = .00001 Uno  Too big is returned. Too small is kept. Dust is returned on a losing bet.,"gambling,games,software"
e579f9e4-3525-4310-a685-39d97f56123b,http://ff4lphku3n7qohw47zizet7gxwy3elkaini6kfu2xlxmuqomyf6dnlqd.onion,Piping Server in Go 0.4.0,Streaming Data Transfer Server over HTTP/HTTPS,"fileshare,utilities"
8005c4fe-94d6-49fa-9e65-1e47f050c7da,http://cy6wj77vryhcyh6go576hxycjz4wxlo4s5vevdinkw3armwzty5jozyd.onion,2600 - The Hacker Quarterly | SecureDrop,"Please note: Sharing sensitive documents may put you at risk, even when using Tor and SecureDrop.  SecureDrop is a project of Freedom of the Press Foundation. ","securedrop,whistleblowing"
9ac59dc9-3819-4cfa-95d3-7e6a23e2ab08,http://jkta32w5gvk6pmqdfwj67psojot3l2iwoqbdvrvywi5bkudfeandq7id.onion,AlJazeera | SecureDrop,"Please note: Sharing sensitive documents may put you at risk, even when using Tor and SecureDrop.  SecureDrop is a project of Freedom of the Press Foundation. ","securedrop,whistleblowing"
b7975c7d-e574-468d-ba77-6354ed7c3b14,http://xm33ge4kupk5o66eqxcd2r4fqcplpqb2sbdduf5z2nw4g2jrxe57luid.onion,Aftonbladet | SecureDrop,"Please note: Sharing sensitive documents may put you at risk, even when using Tor and SecureDrop.  SecureDrop is a project of Freedom of the Press Foundation. ","securedrop,whistleblowing"
fd0bd0d7-41f5-4bb0-aed9-c78beb9210d8,http://ogdwaroarq4p6rnfn2hl4crvldyruyc2g24435qtxmd3twhevg7dsqid.onion,Bloomberg | SecureDrop,"Please note: Sharing sensitive documents may put you at risk, even when using Tor and SecureDrop.  SecureDrop is a project of Freedom of the Press Foundation. ","securedrop,whistleblowing"
0b2ea21d-2879-4e84-b69f-c3e1bf0d8015,http://okd7utbak43lm7qaixr6yv7s62e32mhngjsfpjn26eklokqofg6776yd.onion,Apache | SecureDrop,"Please note: Sharing sensitive documents may put you at risk, even when using Tor and SecureDrop.  SecureDrop is a project of Freedom of the Press Foundation. ","securedrop,whistleblowing"
987e03fa-4e4a-4cf1-9ea3-f10fd91b5c19,http://gppg43zz5d2yfuom3yfmxnnokn3zj4mekt55onlng3zs653ty4fio6qd.onion,CBC / Radio Canada | SecureDrop,"Please note: Sharing sensitive documents may put you at risk, even when using Tor and SecureDrop.  SecureDrop is a project of Freedom of the Press Foundation. ","securedrop,whistleblowing"
f2641bce-1838-4964-8c36-0844db1cda35,http://udgkmwzb5jmucs2r2cjtfscgf6s6d6otbt2qfiinovtwknsxk5oyzeid.onion,Dagbladet | SecureDrop,"Please note: Sharing sensitive documents may put you at risk, even when using Tor and SecureDrop.  SecureDrop is a project of Freedom of the Press Foundation. ","securedrop,whistleblowing"
9398ff5b-f5c6-4f03-8660-97e86d3e1c7d,http://nqu6crmtnzs2hs5abo2uqni53yqsnnwqnerdxuzyz5yxairxlzjzt6yd.onion,Financial Times | SecureDrop,"Please note: Sharing sensitive documents may put you at risk, even when using Tor and SecureDrop.  SecureDrop is a project of Freedom of the Press Foundation. ","securedrop,whistleblowing"
126934fe-b412-4d28-ae59-13d442f0a231,http://ppw2pmtagxykinex6uubypsommtrcg6ytdh6bcr6agq2wxnrweao4cad.onion,HuffPost | SecureDrop,"Please note: Sharing sensitive documents may put you at risk, even when using Tor and SecureDrop.  SecureDrop is a project of Freedom of the Press Foundation. ","securedrop,whistleblowing"
8f4c604f-bab4-4ba1-897d-8be8423f9977,http://fg25fqpu2dnxp24xs3jlcley4hp2inshpzek44q3czkhq3zffoqk26id.onion,Forbidden Stories | SecureDrop,"Please note: Sharing sensitive documents may put you at risk, even when using Tor and SecureDrop.  SecureDrop is a project of Freedom of the Press Foundation. ","securedrop,whistleblowing"
45a4bb31-e7c7-422e-8ab6-335770a44d50,https://ej3kv4ebuugcmuwxctx5ic7zxh73rnxt42soi3tdneu2c2em55thufqd.onion,The New York Times | SecureDrop,"Description: Please note: Sharing sensitive documents may put you at risk, even when using Tor and SecureDrop. SecureDrop is a project of Freedom of the Press Foundation. ","securedrop,whistleblowing"
67d7938c-be63-4c85-9bd9-8edab8a04b88,http://lvtu6mh6dd6ynqcxtd2mseqfkm7g2iuxvjobbyzpgx2jt427zvd7n3ad.onion,ProPublica | SecureDrop,"Description: Please note: Sharing sensitive documents may put you at risk, even when using Tor and SecureDrop. SecureDrop is a project of Freedom of the Press Foundation. ","securedrop,whistleblowing"
525c76da-4b6b-4c7d-9628-c4ddd31b9301,http://537ztcntpbmspja4mkpxldpsoc46mqlssnsaklqnfw3gnlpj5glcjgid.onion,NRK | SecureDrop,"Description: Please note: Sharing sensitive documents may put you at risk, even when using Tor and SecureDrop. SecureDrop is a project of Freedom of the Press Foundation. ","securedrop,whistleblowing"
040190e7-9fce-4b7f-8c73-ad3997d2304b,http://z4gd5t2g6u6kqeqjeddvmvlhhjtjgslg4elh4ztnct7snskcd7phbiyd.onion,Public Intelligence | SecureDrop,"Description: Please note: Sharing sensitive documents may put you at risk, even when using Tor and SecureDrop. SecureDrop is a project of Freedom of the Press Foundation. ","securedrop,whistleblowing"
3785e276-383a-4826-81f5-899ab087fcf2,http://a4zum5ydurvljrohxqp2rjjal5kro4ge2q2qizuonf2jubkhcr627gad.onion,The Globe and Mail | SecureDrop,"Description: Please note: Sharing sensitive documents may put you at risk, even when using Tor and SecureDrop. SecureDrop is a project of Freedom of the Press Foundation. ","securedrop,whistleblowing"
1a7fa063-adab-4705-8e03-845e0faa1ff1,http://srumyob2jq5nvppzt66aaab333n2wmq6xgkg4khfe24ixdb7umf7mtyd.onion,TV2 Denmark | SecureDrop,"Description: Please note: Sharing sensitive documents may put you at risk, even when using Tor and SecureDrop. SecureDrop is a project of Freedom of the Press Foundation. ","securedrop,whistleblowing"
97ee2a1d-5879-46ca-be23-c6b29f062613,http://yj3b7rgmglcocbbvzrwfbo4d6j2aa7thwupra4yqutbd27v3vxcpvgid.onion,Toronto Star | SecureDrop,"Description: Please note: Sharing sensitive documents may put you at risk, even when using Tor and SecureDrop. SecureDrop is a project of Freedom of the Press Foundation. ","securedrop,whistleblowing"
a14ed6ad-5e2e-43f2-9939-173ede54d8e9,http://kogbxf4ysay2qzozmg7ar45ijqmj2vxrwqa4upzqq2i7sqj7wv7wcdqd.onion,Whistleblower Aid | SecureDrop,"Description: Please note: Sharing sensitive documents may put you at risk, even when using Tor and SecureDrop. SecureDrop is a project of Freedom of the Press Foundation. ","securedrop,whistleblowing"
eec78a55-134d-4a87-a5f4-531d01c58480,http://dvvbik7vtmvwwgj2cziqa36noa26l2pweghd26e5l5qwdnqtwmfhz5id.onion,Reuters | SecureDrop,"Description: Please note: Sharing sensitive documents may put you at risk, even when using Tor and SecureDrop. SecureDrop is a project of Freedom of the Press Foundation. ","securedrop,whistleblowing"
bbcff36a-dd8b-4387-af4e-e5fe2cde4df5,http://a2c6mmacrmxtaspbolytfxm6q2zq7svtkuaog5xetbcxr3mpy4pmomid.onion,Vice Media | SecureDrop,"Description: Please note: Sharing sensitive documents may put you at risk, even when using Tor and SecureDrop. SecureDrop is a project of Freedom of the Press Foundation. ","securedrop,whistleblowing"
af395408-b374-4927-972e-ec2b6c1fcead,http://fdstaat23zv6kdmntgkvdzkr7hipl5oqswwi3xawzkj2w2gwsbxmrwyd.onion,FragDenStaat - Portal für Informationfreiheit,"Wir bringen Licht ins Dunkel der Behörden  Jede Person hat das Recht auf Informationen aus Politik und Verwaltung. FragDenStaat hilft Ihnen dabei, Ihr Recht durchzusetzen.","activism,deutsch,political"
35212f0a-ca25-4518-8a5c-bb7029ede1d2,http://jebqj47jgxleaiosfcxfibx2xdahjettuydlxbg64azd4khsxv6kawid.onion,Nitter - Seth For Privacy,Nitter is a free and open source alternative Twitter front-end focused on privacy and performance,twitter
bc05bc12-3b1e-409e-b305-0b067d605d25,http://tormailgkzt4aisvaoiym5x2prqlnptca3wyqpffxjn67mpiejts3wyd.onion,Tormail.io || Anonymous email service,A secure mail storage that uses asymmetric encryption to ensure the privacy of messages while being stored on the Tormail servers. Asymmetric encryption is a process that uses public key and private key encryption to make messages unreadable without knowing a user's plaintext password.,email
e51124ff-e9f2-43ef-8cd8-c80d47c15e55,http://martymcgfuraocsgy2a25btl5srhifcdud6m4eiphz2mq6fafttwh7qd.onion,Marty McGuire," Marty McGuire is a web developer in New York, NY. He can also be found posting cat pictures, streaming and podcasting, performing improv comedy, and building IndieWeb things.  He also enjoys listening to podcasts, reading, and posting photos.",blog
6a0d9f1a-0eb3-447f-98d1-c11f21f40b2b,http://csrinrutkb3tshptdctl5lyei4et35itl22qvk5ktdcat6aeavy6nhid.onion,CS.RIN.RU - Steam Underground Community,Russian-language,forum
94136d16-cf69-4a3e-9c34-21938bd398b9,http://infinityjs5qob5euyao745kp5x2hh4xquh7qs5cze3kcxv63xdwxlad.onion,Infinity Project,,coin_exchange
26d86e7c-2c9f-4dd3-9686-7143d6833729,http://qvt3o2ipzxx3gtoyafd3ptqwsxjs52enlwlxuryn2xjkm7hnp5icd6yd.onion,CoyIM | Safe and secure chat client," Multi-platform chat client for XMPP CoyIM is a self-contained program that runs on Windows, Linux and macOS, and that is safe from the moment it starts. CoyIM is made for use with one chat protocol - XMPP.","xmpp,software"
c6862f35-55b7-4095-acc7-f221192bbc46,http://ce6roic2ykdjunyzazsxmjpz5wsar4pflpoqzntyww5c2eskcp7dq4yd.onion,BlackByte BLOG,Ransomware leak market,ransomware
72f33e92-28f5-42d2-aaaa-f8a7fe86b4a4,http://hiveleakdbtnp76ulyhi52eag6c6tyc3xw7ez7iqy6wc34gd2nekazyd.onion,Hive Leaks [Seized by Law Enforcement],Hive Ransomware Leak Blog,ransomware
170cb81f-8a0d-4eea-8ff8-1815afbddda8,http://avosqxh72b5ia23dl5fgwcpndkctuzqvh2iefk5imp3pi5gfhel5klad.onion,AvosLocker,Ransomware leak site,ransomware
3c59c858-6d68-4184-9340-fef916187293,http://prnoid54e44a4bduq5due64jkk7wcnkxcp5kv3juncm7veptjcqudgyd.onion,Be Paranoid - Frontend Hosting Provider,"Provides a SimplyTranslate, Librebin, Bibliogram, libreddit, Invidious, LibreX, SquirrelMail, and Wikiless Intance!",frontend
43e07710-71d5-42af-97eb-20723adb23ba,http://5amrwxem7te6pddtqr7n6haon6xouaggmhxq6w2xpklefejlllclc3id.onion,A l’ouest - Site coopératif d’informations locales et d’ailleurs,"Comment publier sur A l’ouest - Site coopératif d’informations locales et d’ailleurs, sur Rouen et alentours?  A l’ouest - Site coopératif d’informations locales et d’ailleurs, sur Rouen et alentours n’est pas qu'un collectif de rédaction, c’est un outil qui permet la publication d’articles que vous proposez. Quelques infos rapides pour comprendre comment être publié ! Si vous rencontrez le moindre problème, n’hésitez pas à nous le faire savoir via le mail alouest@riseup.net","francais,news,activism"
78d9544a-66aa-47e4-ae49-b38dfa42ff6f,http://lyeufajq7n43xog2bsdcyu3pqt56hucwcnwq2b4hnxlqhszk4alkhnid.onion,EMRAWI -  Infos zu sozialen Bewegungen und radikale Analysen," Wie wird ein Artikel auf EMRAWI veröffentlicht?  EMRAWI ist eine emanzipatorische, radikale und widerständige Informationsplattform für bewegungs- und strömungsübergreifende, parteiunabhängige Publikationen in Österreich und darüber hinaus. Es ist eine Plattform, auf der alle veröffentlichen können, solange der Inhalt der Veröffentlichung nicht den Ansprüchen der Seite widerspricht und davon lebt die Seite: Die Seite möchte es möglichst vielen Leuten ermöglichen, leicht zugänglich und anonym Texte zu veröffentlichen.  Wenn du einen Beitrag veröffentlichen willst, brauchst du einen Account, den du ganz schnell und formlos anlegen kannst. Wie das genau geht steht HIER . ","deutsch,activism"
0e92d376-f3fa-432d-ba6e-5891c4834e8d,http://bkejyh6jkyvn7zogkjwag4xtbzy5z5mi5unudmq624vd6xlrx3iudsyd.onion,gic.php - geistige Gefährdungen (php),,"activism,deutsch,library,news"
f45babe3-14c7-450f-90f3-453f83273680,http://xs4y22l6fxcoapcu4qurmbr2ne6l5mfynmo3kkvth4cuvhrjrtgcrmqd.onion,indy-Spiegel,"Willkommen Dies ist ein statischer Spiegel der Seite de.indymedia.org. Spiegel bedeutet, dass alle heute noch zugänglichen Artikel die von 2014-2020 auf indymedia erschienen sind hier zur Verfügung stehen. Statisch bedeutet, dass die Seite keine sonstigen Funktionen wie Suchen oder ähnliches ermöglicht. Auch sind keine Dateien beinhaltet, allerdings die Links zu den entsprechenden Dateien auf einem anderen Spiegel.","news,activism,deutsch"
8d3d76e1-1690-40da-8dcf-8d2001a035fe,http://pzoorzp7ckherc6jma6dg73hi4qerxi7uczapryk7bullfhavekezqyd.onion,Reims Medias Libres - Site collaboratif d'information locales,"ReimsMediasLibres.info n’est pas un collectif de rédaction, c’est un outil qui permet la publication d’articles que vous proposez. La proposition d’article se fait à travers l’interface privée du site. Quelques infos rapides pour comprendre comment être publié ! Si vous rencontrez le moindre problème, n’hésitez pas à nous le faire savoir via le mail ReimsMediasLibres [at] riseup.net","news,activism,francais"
f10f8d52-84a9-4e14-9162-3e8d9cf99a9d,http://47gl6q5kyjaihmuudezv3kw545a5cugmnwnqxxufvrfx6mjuiydh74ad.onion,Business Wall |  An uncensored World Business Expo website.,© 2022 Business Wall An uncensored World Business Expo website.,market
0e9a0129-6b64-4c17-baa4-888738abd917,http://pr3ygifxd23xu43be2fegjjsk5jlb22q2va2h5apz76ejbvammeclkid.onion,Denkbares | …nichts zu gewinnen ausser dem an den kopf geworfenen blumentopf…,Aufgrund der angekündigten Schliessung von blogsport.de ist der Blog http://undenkbar.blogsport.de in den Untergrund gegangen und nun als Onion-Service auffindbar unter http://pr3ygifxd23xu43be2fegjjsk5jlb22q2va2h5apz76ejbvammeclkid.onion,"rss,deutsch,blog"
281201da-928a-45e4-9003-d2d193b8536d,http://luebnj7odhlmwmfsppkjrzaaxlgsihhwarzcaurf3yonwaw4qqoyenid.onion,Anonymous file hosting,Files are stored indefinitely - Multiple files can be uploaded at once - Size limit per file: 20 MiB,fileshare
9a469ca3-0f7e-4ea2-a866-c793d859e8a3,http://5ety7tpkim5me6eszuwcje7bmy25pbtrjtue7zkqqgziljwqy3rrikqd.onion,oshi.at - Oshi - Anonymous file storage,Ephemeral file sharing engine ,fileshare
39b84eb2-66b9-4142-aa51-8c8cf1634d11,http://lgcofwqbrv5lvokobzfeuvebnag3sqnrfctmbijkrk2ttdtff2oxobad.onion,Carding Dollars," Carding tutorials, Tools, Carding Methods, and Basics. ","fraud,information"
4b6f4eee-2db3-42fc-869a-7dd695889e00,http://retro56qdosu3zuisr5tiuh7ihpn6owzpwjwvs7djlweiqb3mcspahyd.onion,RetroJunkie.net - Get Your Fix!,This website is under construction; ,misc
c4267ff4-d4cd-4e96-b931-2215e3f10b0d,http://fishnetski77aqzeo7trux7agla7mqb6jzw5r43mmdzkmjsmsdikodid.onion,Fish Tank World,Thank you for visiting our homepage. We are a collection of lovely fish. Bookmark this page now to enjoy looking at us.,misc
6a555e70-48b0-4f1e-b6e3-297a49962710,http://chirpysl54soda3vpws5erwcoh32cjky33xkrj4cr7fxbaia2cqhdnyd.onion,Channel Chirped - Green-cheeked and big-beaked!,"Chirp, chirp, quack! Welcome to our homepage! We are the most adorable green-cheeked conures in Australia! Thank you for taking the time to visit and be sure to check out our adventures and our YouTube Channel. We are Tillie, Pudge and Chip!","misc,blog"
600ea738-1bc9-49e4-b25e-ea12f5d91960,http://spacewarpwv4jfef5um36c7bzofwrslnvky2lkgk2e3tqgvlzbwvbcyd.onion,Space Website 1996,Powered by the McRetro Network.,misc
e1f4c897-dd95-4992-83e9-76b4ca7ce082,http://pepperfoxgryauwqd4llzyqyczdbi3gey67dm7ug7xhf7ponf5i65zyd.onion,Pepper the Dog Blog," Powered by the McRetro Network.","misc,blog"
f68a42a0-9e21-4296-9e63-4cf81c4deb43,http://nwwheo3luizwv2vzku3c4xes7sjipyjyzzsj273lmu3j2ur4bchuhbid.onion,Woah,"Woah is a minimalist, open source online pastebin where the server has zero knowledge of pasted data. Data is encrypted/decrypted in the browser using 256 bits AES. More information on the project page. ",pastebin
8c6a5b14-8e7b-4a5a-965f-47396a6ab4d5,http://3dglwm65senudd7vqyn6wkwpj2wnwp2rfiw4lmbfa7j6as4b5ekix2id.onion,Index of / - Official mirror of mirror-master.debian.org,,"debian,repository"
