UUID,URL,Title,Description,Categories
4dc0052a-71ff-4d87-bc91-3452a5eaaae7,http://wannab666qqm2nhtkqmwwps3x2wu2bv33ayvmf4jyb6g3ibmitdzkcyd.onion,wannabuy RDP,номер #1 зашифрованный маркетплейс на даркнете,"rdp,proxy"
62ef2f1c-09ad-45e0-ac80-3a2288a70057,http://vsockskoywh575svvek7ktpsuy7un67qfd32nj52wkqguriu2jcpgrad.onion,V-Socks,"We offer a large amount of high quality Socks and HTTP Proxies, currently totaling 36 proxies from 22 countries. Similar to VPN, proxies allow to anonymize your IP address, circumvent geo blocking and bypass censorship. Find the optimal proxy by applying multiple filters like location, speed, proxy type, blacklist count and more.",proxy
0198bf93-3058-4e33-a303-09235990c3fb,http://6hasakffvppilxgehrswmffqurlcjjjhd76jgvaqmsg6ul25s7t3rzyd.onion,Bitcoin Core :: Bitcoin,Bitcoin Core is an open source project which maintains and releases Bitcoin client software called “Bitcoin Core”.,bitcoin
d171bf2d-5057-4850-87fb-7500ae8fa9a0,http://wasabiukrxmkdgve5kynjztuovbg43uxcbcxn6y2okcrsg7gb6jdmbad.onion,Wasabi Wallet - Bitcoin privacy wallet with built-in coinjoin,"Wasabi is an open-source, non-custodial, privacy-focused Bitcoin wallet for desktop, that implements trustless coinjoin.",bitcoin
db00c2f3-cfe8-41c8-9502-209a8c42c571,http://72typmu5edrjmcdkzuzmv2i4zqru7rjlrcxwtod4nu6qtfsqegngzead.onion,Samourai Wallet ," A modern bitcoin wallet hand forged to keep your transactions private your identity masked and your funds secured.",bitcoin
e046ef44-bbd1-42c0-9db2-ba5a69b93dc7,http://spore64i5sofqlfz5gq2ju4msgzojjwifls7rok2cti624zyq3fcelad.onion,"SporeStack: VPS hosting for Bitcoin, Bitcoin Cash, and Monero. No email required, API-driven.","SporeStack is more expensive than hosting directly with Vultr or Digital Ocean. But, you don't have to provide credit card information. You pay in crypto and you get a server. Simple. There's an API as well, if you're a developer.","cryptocurrency,hosting"
91749d5d-c2e6-40ef-9c94-6f709b52a9f9,http://mempoolhqx4isw62xs7abwphsq7ldayuidyx2v2oethdhhj6mlo2r6ad.onion,mempool - Bitcoin Explorer,Bitcoin block explorer,bitcoin
dbe642e5-13d0-45d2-b83b-9020555892b5,http://explorerzydxu5ecjrkwceayqybizmpjjznk5izmitf2modhcusuqlid.onion,Bitcoin Explorer - Blockstream.info,"Search for block height, hash, transaction, or address.","cryptocurrency,bitcoin"
7766426e-6248-4969-ae1d-acf842b5bcae,http://blkchairbknpn73cfjhevhla7rkp4ed5gg2knctvv7it4lioy22defid.onion,Blockchair," Blockchain explorer, analytics and web services Explore data stored on 17 blockchains",cryptocurrency
89332802-693a-4d2c-8396-146cb2019f47,http://btcw3wabdz3zmt7f6k37k7km5ll6gom2kwf5hxpzd7djuqrhsdhtodqd.onion,Hidden Bitcoin Wiki - The Bitcoin Guide,Predominantly scam links. Beware,bitcoin
6ef0d8de-8e87-4d2d-ad66-1bdeb1c984e0,http://featherdvtpi7ckdbkb2yxjfwx3oyvr3xjz3oo4rszylfzjdg6pbm3id.onion,Feather: a free Monero desktop wallet," Feather is a free, open-source Monero wallet for Linux, Tails, Windows and macOS. ","cryptocurrency,monero"
23c8dfef-099a-4314-a1cf-3d147b031a9a,http://xmrguide25ibknxgaray5rqksrclddxqku3ggdcnzg4ogdi5qkdkd2yd.onion,xmrguide,This site will guide you through the process of setting up a Monero wallet on Tails and Whonix.,"cryptocurrency,monero"
f9871f59-5091-4bd2-b890-3ba70b0c352b,http://monerotoruzizulg5ttgat2emf4d6fbmiea25detrmmy7erypseyteyd.onion,"Monero - secure, private, untraceable","Monero Means Money | Private, decentralized cryptocurrency that keeps your finances confidential and secure","cryptocurrency,monero"
f593e6d9-a909-4f3c-8375-8e6fe2d18ea6,http://trezoriovpjcahpzkrewelclulmszwbqpzmzgub37gbcjlvluxtruqad.onion,Trezor Hardware Wallet (Official)  The original and most secure hardware wallet.," Trezor. Invented for your digital freedom.  Securing your digital assets has never been more straightforward.",cryptocurrency
1b8c8490-f177-42d7-aa85-c16b5e4e713e,http://kbhcl3suo7mebwn5iamnncuopqlraqzygsuizubjvmtyiepe7j4xvlad.onion,S.Dock - Ultimate DW Intel,"Now the idea of this blog. Shadow Dock will be a co-working space of deepweb authors wanting to share their experience. The topics are various: scam alerts, service and website reviews, cryptocurrency guides, business and laundry guides, revealing new schemes etc. It is hard to predict what exactly will be on the website because it depends on the authors and audience. The only thing I can say for sure is that this place will be useful for the whole TOR network",cryptocurrency
3835e88f-b918-4f7b-9d96-17c0e2c330d6,http://bitcoin4x427bkoozfk3uxut4cssb7ufh3fnb7phcbhpietuwrsfllad.onion,Bitcoin Hidden Full Node,Remote .onion bitcoin remote node,"cryptocurrency,bitcoin"
1c018c6b-811b-46f7-870c-724ac6c7d811,http://qn6cp765b6qgh2iuzpagerrgl5g6dhygaa6scyfjk2gpjnxbhyztanqd.onion,MoneroOfflineWalletGenerator,,
16df1c8d-942e-45c2-af36-2418818cdd56,http://cqglonmhq4hrpw5nz67hvbw43vickt5rdazjz57pv5gxbk72d5wdagad.onion,Crypto Payments Gateway,Easily and securely process crypto payments for you website over Tor,"cryptocurrency,utilities"
0b3f06a6-b66b-4d8c-8673-22d12384f09b,http://nehdddktmhvqklsnkjqcbpmb63htee2iznpcbs5tgzctipxykpj6yrid.onion,LocalMonero,"Buy or Sell Monero Anonymously, Quick and Easy","monero,coin_exchange"
b854f2b2-3b25-481c-bd6a-6e2a7f7c2a83,http://2jopbxfi2mrw6pfpmufm7smacrgniglr7a4raaila3kwlhlumflxfxad.onion,AgoraDesk,"Buy or Sell Bitcoins Anonymously, Quick and Easy",coin_exchange
537820f7-8a19-444c-a745-42c4b37faebf,http://aa7oyok6dxgyedeteldaumqjernm5ai7dnpqayy3p4q7solc6dxi5vad.onion,Xchange.me - exchange crypto anonymously,"These uncertain times cause Us to step back a little, and reconsider how to proceed with the xChange.me platform.  Last few months have changed the world we live in so drastically, that we cannot proceed the same way any longer. It doesn’t mean that the xChange.me project is dead – we just need a little time to rethink some elements of the platform, and implement some improvements that we’ve been working on lately.  The community will remain active, as we’ll share more details about our timeframe in the upcoming weeks. See you later!  All xChange.me users! Please bear in mind, that this is the only iteration of xChange.me crypto exchanger. We've seen many imposters over the years, and can only assume that there'll be many to come. Please do not trust your funds with those fake services, as all of them are most certainly scam projects.",coin_exchange
7592d111-a33e-4499-82a4-a591a66245a4,http://adamantim24okpwfr4wxjgsh6vtw4odoiabhsfaqaktnfqzrjrspjuid.onion,Adamant,"Decentralized, anonymous and secure Messenger, Crypto Wallet and Exchange on a Blockchain","coin_exchange,messaging"
6de26ec3-ded6-4acb-a9b3-10f21ed72a7b,http://leakfindrg5s2zcwwdmxlvz6oefz6hdwlkckh4eir4huqcpjsefxkead.onion,Search Instagram Accounts - Breach Database Search," Dear friend, Instagram Informer is not like as Leaked passwords service.  Do not search your Instagram user ID or your information !!  For example, This service find Instagram users with most followers.  Please Read FAQ and Examples Carefully, to learn How it works. ",leaks
e3c2deaf-8aab-4172-a4e1-c44a75234ca3,http://ddosxlvzzow7scc7egy75gpke54hgbg2frahxzaw6qq5osnzm7wistid.onion,Distributed Denial of Secrets,"Distributed Denial of Secrets is a journalist 501(c)(3) non-profit devoted to enabling the free transmission of data in the public interest.  We aim to avoid political, corporate or personal leanings, to act as a beacon of available information. As a transparency collective, we don't support any cause, idea or message beyond ensuring that information is available to those who need it most—the people. ","leaks,whistleblowing"
c5b7884f-debd-4288-9d3d-1590435156db,http://gfa77iir5f7hkndryl7a4sq6fh6ivjqbgq2cesdh7dxoteo5sfcvzwid.onion,BankLogs,Leaked banking logs.,leaks
c895f07b-ba5d-40e8-883b-7a7a704facb6,http://breachdbsztfykg2fdaq2gnqnxfsbj5d35byz3yzj73hazydk4vq72qd.onion,Leaked Database Search Engine," Search Instagram Users - Leaked Password Database; There are currently 462,571,547 accounts in Instagram Database  and about 12 billion accounts in our Leaked Database.",leaks
130ddc3c-182f-4211-9893-501e989993e8,http://g7ejphhubv5idbbu3hb3wawrs5adw7tkx7yjabnf65xtzztgg4hcsqqd.onion,DEF CON® Hacking Conference,Website for the conference,other
eb5fb0e4-a594-4c51-bb19-78cf46f10deb,http://uvbpohizz2ez5q2vbegzx4mc4dezc7tdttd6y6tnnk54bv6icwn4ywqd.onion,BlackCourses," You will find here every Course u need to become an Professional Pentester Yeah You will be an Expert Black hat Hacker $! ",tutorials
81244b6d-94e0-447e-b5e2-50524100c020,http://cisland46psf56panbm2japxoxeguqekmataim54kn2ysucnk3yo7eyd.onion,Cracking Island,"Cracking Island is a huge and COMPLETELY FREE collection of the latest ethical hacking and cracking programs, only for educational purposes","software,hacking"
1586a3f7-894b-473d-a0bb-01b3855fac7b,http://exploitcg4vgnojziq3g2jwn2tbdli552k7chexswgrqucqhbxkydjad.onion,Online Office Exploit Builder,"Exploit Builder - for Office 2013, 2010, 2007, 2003 -( It converts .exe to .doc ) - You must (Register and Purchase) to use this service !! ","services,hacking"
d9917b65-0167-4c7f-ab55-b48f6f9f4778,http://my44oqht5l6xzcw34ueby5qbpupwffi4a7xuub3cjvusar6fls7zr7id.onion,HackSpyApps,,
80f34da3-8d17-4ddd-aab7-11ec7bddaeda,http://4wbwa6vcpvcr3vvf4qkhppgy56urmjcj2vagu2iqgp3z656xcmfdbiqd.onion,Fuck Facebook (TM),"435,627,630 indexed items from that Facebook dump of recent - ready to be searched upon.",leaks
409eb48c-24c5-4070-8903-944b8e458c13,http://caseslrwwcr744frvczmogqpa5jxfl6qhx3fxi2ne5pnro4yvsevhzid.onion,Judicial Review - Legal.cases,"Search the text of tens of thousands of legal decisions. Criminal, civil, administrative, and arbitrage.","osint,legal"
aecbfa26-938a-4a28-bb99-ced1c5c6b2cc,http://rlp5gt4d7dtkok3yaogocbcvrs2tdligjrxipsamztjq4wwpxzjeuxqd.onion,Bibliogram,"Bibliogram is a website that takes data from Instagram's public profile views and puts it into a friendlier page that loads faster, gives downloadable images, eliminates ads, generates RSS feeds, and doesn't urge you to sign up. ","utilities,social"
a810ef4a-bb7b-4837-a4fa-cae2885a3483,http://g5kx4zfref7kakmolaxb2nwmgkmo7agiznzvldeay2rks3pi643lpwad.onion,DeAtHaLiVe's blog,Personal website,blog
be33839f-236d-48b0-840a-6791950219a3,http://hostin77ottjghjdmj6um3t3nzoakxotz2pvit72wq7ogwq3we2neiqd.onion,Web Hosting,"Apache, PHP7, MySQL,  SFTP access + Free specific .onion domain with your 8 first letters",hosting
85c2c152-b4cc-4c7b-8c2e-a73551114385,http://3p5z2juq6ktgi2ebdbqrk2hapag56e3fudete42ailxk3xe6gejk4pyd.onion,VPN.sn,"Anonymous VPN service, RDP remote desktop and TOR. | VPN.SN",vpn
9c44bdd0-1524-4565-8f4f-e431c0070b47,http://pwn4l4mut2nejt7yavwl35dbfwswfl5uiqz6fvli7dbyukvr2vvfdqyd.onion,Libre Chat,Live Relay Chat Without JS (Beta Test) Made with care by Incognito Team,chat
653d8025-7db9-4482-98e5-d48387539e45,http://hl66646wtlp2naoqnhattngigjp5palgqmbwixepcjyq5i534acgqyad.onion,snatch news,"All leaks, includiing any kind of critical, private or particularly important information will be published in case of refusal to negotiate If earlier we tried to filter the published data, since now we refuse to use censorship. ",ransomware
2a1a51ba-dd8e-4cf2-971c-5195c26f0730,http://hackere76xm7ujmrzdwdjqywetlpio4e5526ps625kmrc6z2k64gsjqd.onion,Illusion 3,cyber security forum memes and stuff,"forum,social"
d8c81598-3445-45c8-acc5-ce3db07b0a3e,http://darknet7l2gxurmadtuv3w3554fv55xykjb2ypfbhr5k7uzdmpjkvbad.onion,Dark Net Daily,"Darknet news, interviews, arrests, blog, & tutorials",news
01abc350-790b-4849-9259-c3ee6b87432a,http://bbcweb3hytmzhn5d532owbu6oqadra5z3ar726vq5kgwwn6aucdccrad.onion,BBC Home,Official onion mirror the British Broadcasting Corporation website,news
663fb294-76e2-4cdd-be44-036162ed3907,http://27m3p2uv7igmj6kvd4ql3cct5h3sdwrsajovkkndeufumzyfhlfev4qd.onion,TheIntercept,,news
57aa31d5-3e39-409a-86a3-70066a689d73,http://nytimesn7cgmftshazwhfgzm37qxb44r64ytbb2dj3x62d2lljsciiyd.onion,The New York Times,"Breaking  news, US news, World news and videos.",news
58fff67b-2cda-44d8-a50e-d0fed605ed43,http://fileboxurlqpwcn6agxz7643mptava6aqufty32o2ln75vsnxwxquzqd.onion,File Box,FileBox - Host Large Files Free,fileshare
f9d3e588-ff2a-4163-8f7f-cd9d1e7afce5,http://hpm242zmcxettb74wkl77lruaxq5tsmrg4ewwkywxyisy6ub7dk5l7id.onion,Latest security news,News aggregate page - Articles will not be translated,news
8f7dee2b-be43-4d54-84dd-312e58841841,http://qg24mbrij6rzxr77eovjwjzw7zwn7brmegr3yvwvppj4vhdxeuezkdqd.onion,Latest crypto news,News agregate page - Articles will not be translated. ,news
26d8d63c-890e-4cf3-a27a-c6c361a2b59b,http://6w5iasklrbr2kw53zqrsjktgjapvjebxodoki3gjnmvb4dvcbmz7n3qd.onion,Welcome to brand X!,"If you see this page, it's because it has been served by a server and you are browsing it in a browser.  There is an XMPP instant messaging server at this address, anrc.mooo.com. If you want to use it, you can.",xmpp
81ad9ec0-7b2d-4df1-a2ca-1effa9f978ee,http://creep7nonbdm4nad2qbmri7z32ajg2l4vcwvzpxnty6wupvc5vfreoad.onion,creep.im,"This is an XMPP server, not a webpage for viewing in a browser. Registration can be performed using your client's in-band registration. ",xmpp
1988b9c0-81f7-48e1-aace-b47de58dfc6e,http://j77vay55or2d4xztgqwagodilnzrrjhbbhbkwaho2f3sthfangkyfhqd.onion,Dark Web Solutions,Software and Services - The Dark Web Company,"services,software"
cab0eee1-6c70-448a-b143-6255b8b8b3bd,https://twitter3e4tixl4xyajtrzo62zg5vztmjuricljdp2c5kshju4avyoid.onion,Twitter,Twitter's .onion link ,twitter
e64d63a4-8af5-409e-bf93-84e9aeaddb19,http://divestoseb5nncsydt7zzf5hrfg44md4bxqjs5ifcv4t7gt7u6ohjyyd.onion,DivestOS Mobile,"A mobile operating system divested from the norm. ""take back (some) control of your device""",software
ae764434-2eb4-4094-b8d6-1feb5c20d53b,http://dj2tbh2nqfxyfmvq33cjmhuw7nb6am7thzd3zsjvizeqf374fixbrxyd.onion,"Wikiless | Wikipedia, the Free Encyclopedia","Wikiless, an onion mirror of Wikipeida, the free encyclopedia.","wikipedia,frontend"
3e00ae82-9b35-4fe9-aa24-e6eb73923bea,http://x2miyuiwpib2imjr5ykyjngdu7v6vprkkhjltrk4qafymtawey4qzwid.onion,Suncrypt News,Ransomware leak blog,ransomware
4788e51e-1f67-422c-a07c-fc73b17320d9,http://5ruwr5gvqqlozkeetb547lqaglte5rornrcp4ykj3breqa5fncppw6id.onion,Wasabi Wallet is a scam,The numerous problems with Wasabi Wallet mixing Compiled and updated by MoneroHead,"blog,cryptocurrency"
d8a86734-420b-4713-9f22-5292b115a909,http://fireeye62c3da3fnosymmmcqcty7rl7cjucpbkzaz275a4qs5fgkzhad.onion,#LeakTheAnalyst," For a long time we - the 31337 hackers - tried to avoid these fancy ass ""Analysts"" whom trying to trace our attack footprints back to us and prove they are better than us. In the #LeakTheAnalyst operation we say fuck the consequence let's track them on Facebook, Linked-in, Twitter, etc. let's go after everything they've got, let's go after their countries, let's trash their reputation in the field. If during your stealth operation you pwned an analyst, target him and leak his personal and professional data, as a side job of course ;)",leaks
13ca230e-b2b4-4051-86c7-6223d8af66ba,http://3st4foepy7nlpptnamtz5vcykmfsu4clvrodiqqqmtpp4jdzlgvyo3yd.onion,BigBear Escrow,<likely a scam. Use at your own risk> BigBear Escrow | Need a privacy escrow? We got your back!,escrow
8efb459e-8ee7-4854-a76c-57e13ae3c3b0,https://nascosto45qzucs3anw74vipa6td2e7ryjr7k6w3klgbcjx4n4osymid.onion,nascosto.org,/naˈskɔ.sto/ (git and ssl certificates),"git,utilities,blog"
aec7e3ca-6252-4638-ba48-d75ad41d0cf4,http://etv6ce3pbbxvfoevihlqir2xik27rb4j2l5sqpx7d2unhtpiz3ffiqad.onion,Index of / Debian Releases,,"repository,debian"
6f172609-3960-41a3-97be-0c5fe6c42b67,http://fckilfkscwusoopguhi7i6yg3l6tknaz7lrumvlhg5mvtxzxbbxlimid.onion,Index of / IDA Pro ,Archive of IDA Pro versions and keygens.,"repository,software"
17662c61-bcbc-4f6e-a4b5-99bd76cb65b8,http://mempool4t6mypeemozyterviq3i5de4kpoua65r3qkn5i3kknu5l2cad.onion,mempool,Bitcoin Explorer,bitcoin
29b8522c-a7a7-4404-84db-854099bcd553,http://adhoccode34gsycq72umva3hcs44lajzvcpsjsn3ezpcibwc25cujkqd.onion,AdHoc Code,Powered by Gitea Version: 1.16.4,git
e3aa41d5-a008-46b1-9264-6ce555dbbb7a,http://fjblvrw2jrxnhtg67qpbzi45r7ofojaoo3orzykesly2j3c2m3htapid.onion,txtorcon,txtorcon documentation - Control Tor from Twisted,software
1497a0eb-d5af-4043-b70f-ff49bf59d8cf,http://xa2v5hi4gwrvrhj3awz2v4crufymvjhkx3q25wd3n2bpf5574du4afqd.onion,Index of / debian-ports,,"repository,debian"
22ebfd8b-c104-4964-b70c-f54a085beb03,http://kontrpolioglnxrcdwwxfszih4pifyidfjgq4ktfdu6uh4nn35vjtuid.onion,Kontrapolis,Radical Media Berlin,"news,deutsch"
5ea83ee7-e4d2-4ae2-99c4-b6ef4d8aa786,http://4ja5brrs4x4qvgquthmjkjykgxbvnfwau7ucgfb3ebclnkl5cpjyw4yd.onion,media.debconf.org,Various shared debconf.org files,repository
e4c80651-976b-4ad8-b0ef-3817e676520a,http://6xd2lgadylufa4jgjc6e6e3ipojlajxaj5h4whdyc7jvsukfyythxiid.onion,ORANGE MUZIK,#1 FREE MUSIC IN THE DARK WEB,"music,piracy"
dc0cfe17-2ca9-4fad-97de-ea002d6bb61e,http://panzvbljmqb5j2tznnal2aavx2zz7pob3wamueloi6uukrh4v4u6jfad.onion,Panz Mail,panz is free an e-mail service that does not keep any records and does not share any of your data with third parties. and it only serves in the tor network.,email
fe491d5d-a250-4b41-a3de-d5248ccdb048,http://7eoz4h2nvw4zlr7gvlbutinqqpm546f5egswax54az6lt2u7e3t6d7yd.onion,Hidden Answers v.3,Ask questions and receive answers from other members of the community.,forum
17cadf69-b80a-428c-bad1-1f8c37b3ddfc,http://iiz7etcgjlbar5k5j2auvz57ouyipmy2jjcek7aak56e6o5ib7chv3qd.onion,Needy,A place where users can anonymously ask for something and users can freely argue. ,
2a72d022-2ab9-48df-bb54-69cd2ec859de,http://ncfgyuavwl4zbaaqepwjyodckbu2epqj43leo4ac7psfb36kar2uwmid.onion,Free Ross,"We are a group of family, friends and supporters who are working to free Ross Ulbricht from a barbaric double life plus forty-year sentence for all non-violent charges. Our mission is to have Ross be a free man again and give him the chance to start a family and contribute to society. This is Ross’s 9th year in prison. He has expressed heartfelt remorse for creating Silk Road and accepts responsibility for the mistake he made. He has learned his lesson the hard way, and if released tomorrow, he would never break the law again. ",activism
9aac3940-a36b-4d09-a641-65f01023f6cb,http://qco57usxfywwbma34ckgpicmz7jkzlbnrvhx2bccikn6iqon3yhimzid.onion,Tor Web Hosting ,"Apache, PHP7, MySQL, SFTP Access",hosting
e16a3db5-4d9a-4e14-be44-3db22a0ffbe7,http://sonicmfly4cagomgelwtd4hkbsopuhkahfprcvk5hwvb5i2c2q6s7iqd.onion,Sonic the Hedgehog!,Sonic is the coolest,"blog,misc,games"
f05dd6c8-e156-4686-b9ac-9521045238c7,http://hackedabm6ejvmh7xiiqdq3ptflorhdvjurhheqbovlu64xi3zbrlpad.onion,Hacked databases store,Press / or CTRL+F on keyboard to search our database. Click table header to sort databases.,market
b74fea6f-612c-43a5-97df-40ce5b219418,http://travian6dykpkvb7iezmandxudbk2urnvheiy2u7wsbreg7mxle7stad.onion,Endless Server,EndlessServer is a browser game featuring an engaging ancient world with thousands of other real players.  It`s free to play and requires no downloads.,games
07e2fc38-25b6-4867-b5f1-7236361c9b28,http://vzoc4aylgsqwexe6okjbz2ix5atgdv5xyibnkcekmtg4u23syz6a7rid.onion,Onion Mail Project,OnionMail is an anonymous and encrypted mail server meant to run on the Tor network without losing the ability to communicate with the Internet. Created by mes3hacklab.org,"email,utilities,software"
d40fd1f4-96b4-4d0e-9ffd-79f9f1f36f89,https://ezdhgsy2aw7zg54z6dqsutrduhl22moami5zv2zt6urr6vub7gs6wfad.onion,DEF CON forums,What's happening in the world of DEF CON? Official DEF CON community forums,forum
38e37850-853b-41f1-8905-7298b8d754f3,http://bumz4sduzxzlobbgzy5fiufdflg3mo2jyecdwdx5rphrqldms7wlmiid.onion,Monero Documentation,Monerodocs attempts to organize basic technical knowledge on Monero in one place.,"cryptocurrency,monero"
129957d3-87f8-48a6-9e15-50393da3da6b,http://swissbaync5d7ykaz7dh7v4qjrb4gmen5aj3bogxrcgbb43ij34bjuyd.onion,The Swiss Bay,Large repository of information,library
f7aaff19-5ffe-4e1d-869c-d98b4588b050,http://7sbw6jufrirhyltzkslhcmkik4z7yrsmbpnptyritvz5nhbk35hncsqd.onion,lists.riseup.net,"Lists: 18,184(2,140 visible)",links
81fea5e7-355b-47a2-a21c-8534a810f670,http://dcrdata5oppwcotlxkrlsp6afncnxvw54sw6jqftc4bjytm4rn27j3ad.onion,Decred Block Explorer by dcrdata.org,"Decred block explorer; Includes blocks, mempool, ticket pool, attack costs, and more.","cryptocurrency,bitcoin,monero"
93fafb5f-0a8b-4b03-b3a8-fa98f43306a7,http://nascosto45qzucs3anw74vipa6td2e7ryjr7k6w3klgbcjx4n4osymid.onion,nascosto,Provider of SSL certificates for .onion services as well as a git repository.,"services,git"
2f08acb3-c852-44c8-938c-f3fd3b4bbeed,http://oezronzbtheydpio2x64wzf2np6go2abdrtgprmgxh6xi6mjnha6lxad.onion,AnonLeaks,"Research, OSINT, Leaks & News from Anonymous Germany","leaks,news,osint"
d881e228-72c4-4a3c-bf8e-0864ae32cb59,http://6x7g7rr6fhdoszolkqkaittdr6qzgejjxoc42q4ceaph2xttmo5vgryd.onion,Poast,"Poast is a way to join the Fediverse, to be part of a community, and escape the Big Tech™ stranglehold on public discourse.","fediverse,utilities"
050d7395-6975-4165-880b-c97bacd47ac2,http://lu4aakwcq2b5dgqufc464fireyxvjb7o2rcwmojtjwuxlmwcyi345gyd.onion,Anonleaks Fileshare,"Anonaleaks Lufi Fileshare site. Lufi is a free (as in free speech) file hosting software. The files uploaded on a Lufi instance are encrypted before the upload to the server: the administrator of the server can not see the file's content. The administrator can only see the file's name, its size and its mimetype (what kind of file it is: video, text, etc.).",fileshare
5c1f0b07-0490-4fac-b888-0c7b0c21ee73,http://3w63t4tdhijukufciaefkzjpgt7tjejbnubwckxvtdeuhesbgarc5vqd.onion,AnonLeaks Drop,Secure whistleblowing platform by Anonymous Germany,"utilities,whistleblowing"
d55a491b-3770-4db2-a4f1-1418fe77f48d,http://darkcamp5lalvojrioveqbvgemgfy64c5alzmo5mcyjbt7sxm4vtejqd.onion,DarkDotCamp,Darknet news,news
2d74b4d3-883e-4549-86fa-d79d215dabe8,http://ukrainewslsunpkh7tlahmi3sx5rzsftjzp53p32zyfv73d4mp3bnqad.onion,Ukrainews,Informations and News concerning the war in Ukraine.,news
849f50b1-366d-4f06-9ee6-944b78c0bced,http://kzhfp3nvb4qp575vy23ccbrgfocezjtl5dx66uthgrhu7nscu6rcwjyd.onion,Libreddit Instance,Open-source reddit frontend.,"forum,reddit"
05b4c951-a678-4f18-8542-dcbfa2ffff87,http://76i2c3hn55fcj5nut3tqlboqqbbh23zvphv7lefk3vftpx6wketlanyd.onion,Leftypol,Leftypol is an imageboard where users can post anonymously. We engage in both serious political discourse and informal discussion on various topics related to leftist thought. ,"imageboard,social"
a8a57b61-ae46-418a-93f9-7cf61b983c0e,http://ko5enel7ogpruey25y3pcfmobcwrjiwwhyjp3t5nqsuqoytpsjrls2qd.onion,TorShops | Create your own .onion store,Get your own .onion store with full Bitcoin integration.,"software,utilities"
a403b218-3aac-4347-968e-bfebfa88a990,http://kxmrdbwcqbgyokjbiv7droplwhxvli3s7yv5xddxgrtajdpdebgzzzqd.onion,xmr.radio," KXMR-DB | Commercial-free, Privacy-respecting Radio",music
673f1ded-3f64-4488-b4be-7142c8b88eff,http://moz5kotsnjony4oxccxfo4lwk3pvoxmdoljibhgoonzgzjs5oemtjmqd.onion,ZNC - Web Frontend," ZNC is an IRC network bouncer or BNC. It can detach the client from the actual IRC server, and also from selected channels. Multiple clients from different locations can connect to a single ZNC account simultaneously and therefore appear under the same nickname on IRC. It supports Transport Layer Security connections and IPv6. ZNC is written in C++ and licensed under the Apache License.","software,irc"
fc730f97-70dc-45fd-a5cd-ccc367342863,http://s35tjjsibx24bjtgbbhfyf2d3hx2b7hxxfpalrdd5wbweorqkqfyh4yd.onion,Live music recordings,Live music recordings. download and share freely!,music
caf7563f-fce9-4ff7-a676-30ddc104487f,http://spdobp2dcjfg3c56j37y7hmsi6tjauslqvbcgfgvhyuv37yiodphirad.onion,DebConf: Debian 10th Birthday,Debian Hits Double Digits on August 16th 2003!,"software,debian"
04d5c5d9-d643-425c-a25d-6a41ed3d9f2e,http://utnesraitaphpasjotsemksy2nplji3hntcvyupc3yqxk44nbu3d4qid.onion,host4coins,host4coins is a VPS (Virtual Private Server) hosting service which only accepts Bitcoin and Bitcoin over Lightning Network payments.,hosting
cc733726-7b1a-488d-9c85-96b7df0be32e,http://ugndpz7v46llioxb7e4fwqlkcftrzjaypjfkyqswbovosziuo6ujd2yd.onion,Techno-Agorist,Techno-Agorist is a podcast and blog focused on the intersection of technology and agorism.,podcast
8f9fbd50-705d-4060-a2b0-3895cf72a632,http://wx4teirlfbbpbcgagndlyxu6x6v5bndz3cizvcm7e34zsciddysnmwid.onion,Monero XMR VPS Hosting - Steel Mountain VPS,"We are a small, privacy and security focused VPS provider, that accepts payments only in Monero.",hosting
f4aae7b4-304a-4000-af16-4b1263ac36d1,http://xpsuwzyljwcmk3vmurhw5ryvi66azdexzdabng5bqu56r6xc35puyeyd.onion,Bits from Debian ,Blog from the Debian Project,"blog,debian"
dd80e3ea-7eac-4893-a42f-648f3000a99d,http://5xy5balsjlf26ozl3scelc2igqe2azhn2hswmzra7ufoukii5lzkagyd.onion,OnionThumbs - Home,The Dark Web Thumbnail Provider,utilities
5f2b37c7-5dd9-4acf-9cb1-49188b7a1aef,http://5iyr36fkpoarohv2f3esegejdf275smfbrmvuklypol4645n43w6dcad.onion,pseudorandom,"Greetings, stranger! I am Christos, coming from Greece, currently living in location_undisclosed and working (remotely) as Software Engineer for SUSE Software Solutions. On this site I post notes (loosely) related to projects I work on – or better yet play with",blog
f350a72a-7b4c-4871-a5a2-e2c880b4db01,http://bitloadk4rkf7flqesa7tts4qmbngycnqrfictmkhgfhh4qo53w4ofad.onion,"Bitload - Upload, Share, and Sale for Bitcoin",Upload files to sell for bitcoin,"utilities,fileshare"
dcc70770-dc13-475a-9cfa-55cc18d8eba5,http://bibliotgj7uoalolnsxwebynomyz4jwqibaq4hsgl5tnhpvyfmfzsbyd.onion,Bibliot,La bibliothèque et ses cercles infernaux,"library,francais"
